<?xml version="1.0" encoding="UTF-8"?>
<data xmlns="http://www.woltlab.com" xmlns:xsi="http://www.w3.org/2001/XMLSchema-instance" xsi:schemaLocation="http://www.woltlab.com http://www.woltlab.com/XSD/6.0/bbcode.xsd">
	<import>
		<bbcode name="b">
			<htmlopen><![CDATA[b]]></htmlopen>
			<htmlclose><![CDATA[b]]></htmlclose>
		</bbcode>
		<bbcode name="i">
			<htmlopen><![CDATA[i]]></htmlopen>
			<htmlclose><![CDATA[i]]></htmlclose>
		</bbcode>
		<bbcode name="u">
			<htmlopen><![CDATA[span style="text-decoration: underline"]]></htmlopen>
			<htmlclose><![CDATA[span]]></htmlclose>
		</bbcode>
		<bbcode name="s">
			<htmlopen><![CDATA[s]]></htmlopen>
			<htmlclose><![CDATA[s]]></htmlclose>
		</bbcode>
		<bbcode name="sub">
			<htmlopen><![CDATA[sub]]></htmlopen>
			<htmlclose><![CDATA[sub]]></htmlclose>
		</bbcode>
		<bbcode name="sup">
			<htmlopen><![CDATA[sup]]></htmlopen>
			<htmlclose><![CDATA[sup]]></htmlclose>
		</bbcode>
		<bbcode name="email">
			<classname>wcf\system\bbcode\EmailBBCode</classname>
			<attributes>
				<attribute name="0">
					<validationpattern><![CDATA[^[^\s]+@[^\s]+$]]></validationpattern>
					<required>1</required>
					<usetext>1</usetext>
				</attribute>
			</attributes>
		</bbcode>
		<bbcode name="color">
			<htmlopen><![CDATA[span]]></htmlopen>
			<htmlclose><![CDATA[span]]></htmlclose>
			<attributes>
				<attribute name="0">
					<html><![CDATA[style="color: %s"]]></html>
					<validationpattern><![CDATA[^(#([0-9a-f]{3}|[0-9a-f]{6})|[a-z]+)$]]></validationpattern>
					<required>1</required>
				</attribute>
			</attributes>
		</bbcode>
		<bbcode name="size">
			<htmlopen><![CDATA[span]]></htmlopen>
			<htmlclose><![CDATA[span]]></htmlclose>
			<attributes>
				<attribute name="0">
					<html><![CDATA[style="font-size: %dpt"]]></html>
					<validationpattern><![CDATA[^([89]{1}|[1-3]{1}[0-9]{1})$]]></validationpattern>
					<required>1</required>
				</attribute>
			</attributes>
		</bbcode>
		<bbcode name="font">
			<htmlopen><![CDATA[span]]></htmlopen>
			<htmlclose><![CDATA[span]]></htmlclose>
			<attributes>
				<attribute name="0">
					<html><![CDATA[style="font-family: %s"]]></html>
					<validationpattern><![CDATA[^[^"';}\(\)]*$]]></validationpattern>
					<required>1</required>
				</attribute>
			</attributes>
		</bbcode>
		<bbcode name="align">
			<htmlopen><![CDATA[div]]></htmlopen>
			<htmlclose><![CDATA[div]]></htmlclose>
			<isBlockElement>1</isBlockElement>
			<attributes>
				<attribute name="0">
					<html><![CDATA[class="text-%s"]]></html>
					<validationpattern><![CDATA[^(left|right|center|justify)$]]></validationpattern>
					<required>1</required>
				</attribute>
			</attributes>
		</bbcode>
		<bbcode name="quote">
			<isBlockElement>1</isBlockElement>
			<buttonlabel>wcf.editor.button.quote</buttonlabel>
			<wysiwygicon solid="true">quote-left</wysiwygicon>
			<attributes>
				<attribute name="0"/>
				<attribute name="1"/>
			</attributes>
		</bbcode>
		<bbcode name="code">
			<isBlockElement>1</isBlockElement>
			<sourcecode>1</sourcecode>
			<buttonlabel>wcf.editor.button.code</buttonlabel>
			<wysiwygicon>code</wysiwygicon>
			<attributes>
				<attribute name="0"/>
				<attribute name="1"/>
				<attribute name="2"/>
			</attributes>
		</bbcode>
		<bbcode name="img">
			<attributes>
				<attribute name="0">
					<validationpattern><![CDATA[^.+$]]></validationpattern>
					<required>1</required>
					<usetext>1</usetext>
				</attribute>
				<attribute name="1">
					<validationpattern><![CDATA[^(left|right|none)$]]></validationpattern>
				</attribute>
				<attribute name="2">
					<validationpattern><![CDATA[^\d+$]]></validationpattern>
				</attribute>
			</attributes>
		</bbcode>
		<bbcode name="url">
			<attributes>
				<attribute name="0">
					<validationpattern><![CDATA[^.+$]]></validationpattern>
					<required>1</required>
					<usetext>1</usetext>
				</attribute>
			</attributes>
		</bbcode>
		<bbcode name="list">
			<isBlockElement>1</isBlockElement>
			<attributes>
				<attribute name="0">
					<validationpattern><![CDATA[^(1|a|none|circle|square|disc|decimal|lower-roman|upper-roman|decimal-leading-zero|lower-greek|lower-latin|upper-latin|armenian|georgian)$]]></validationpattern>
				</attribute>
			</attributes>
		</bbcode>
		<bbcode name="table">
			<isBlockElement>1</isBlockElement>
		</bbcode>
		<bbcode name="tr">
			<classname>wcf\system\bbcode\TrBBCode</classname>
			<isBlockElement>1</isBlockElement>
		</bbcode>
		<bbcode name="td">
			<classname>wcf\system\bbcode\TdBBCode</classname>
			<isBlockElement>1</isBlockElement>
		</bbcode>
		<bbcode name="media">
			<classname>wcf\system\bbcode\MediaBBCode</classname>
			<sourcecode>1</sourcecode>
			<attributes>
				<attribute name="0">
					<validationpattern><![CDATA[^(left|right|center|none)$]]></validationpattern>
				</attribute>
			</attributes>
		</bbcode>
		<bbcode name="spoiler">
			<isBlockElement>1</isBlockElement>
			<buttonlabel>wcf.editor.button.spoiler</buttonlabel>
			<wysiwygicon>eye-slash</wysiwygicon>
			<attributes>
				<attribute name="0"/>
			</attributes>
		</bbcode>
		<bbcode name="tt">
			<htmlopen><![CDATA[kbd]]></htmlopen>
			<htmlclose><![CDATA[kbd]]></htmlclose>
			<sourcecode>1</sourcecode>
			<buttonlabel>wcf.editor.button.inlineCode</buttonlabel>
			<wysiwygicon>terminal</wysiwygicon>
		</bbcode>
		<bbcode name="attach">
			<classname>wcf\system\bbcode\AttachmentBBCode</classname>
			<attributes>
				<attribute name="0">
					<validationpattern><![CDATA[^\d+$]]></validationpattern>
					<required>1</required>
					<usetext>1</usetext>
				</attribute>
				<attribute name="1">
					<validationpattern><![CDATA[^(left|right|center|none)$]]></validationpattern>
				</attribute>
				<attribute name="2">
					<validationpattern><![CDATA[^(\d+|true|false)$]]></validationpattern>
				</attribute>
			</attributes>
		</bbcode>
		<bbcode name="wsm">
			<classname>wcf\system\bbcode\WoltLabSuiteMediaBBCode</classname>
			<isBlockElement>1</isBlockElement>
			<attributes>
				<attribute name="0">
					<validationpattern><![CDATA[^\d+$]]></validationpattern>
					<required>1</required>
				</attribute>
				<attribute name="1">
					<validationpattern><![CDATA[^(small|medium|large|original)$]]></validationpattern>
				</attribute>
				<attribute name="2">
					<validationpattern><![CDATA[^(left|right|center|none)$]]></validationpattern>
				</attribute>
				<attribute name="3">
					<validationpattern><![CDATA[^(\d+|auto)$]]></validationpattern>
				</attribute>
			</attributes>
		</bbcode>
		<bbcode name="wsmg">
			<classname>wcf\system\bbcode\WoltLabSuiteMediaGalleryBBCode</classname>
			<isBlockElement>1</isBlockElement>
			<attributes>
				<attribute name="0">
					<validationpattern><![CDATA[^\d+(,\d+)*$]]></validationpattern>
					<required>1</required>
				</attribute>
			</attributes>
		</bbcode>
		<bbcode name="wsp">
			<classname>wcf\system\bbcode\WoltLabSuitePageBBCode</classname>
			<attributes>
				<attribute name="0">
					<validationpattern><![CDATA[^\d+(?:#.+)?$]]></validationpattern>
					<required>1</required>
				</attribute>
				<attribute name="1">
					<usetext>1</usetext>
				</attribute>
			</attributes>
		</bbcode>
		<bbcode name="user">
			<classname>wcf\system\bbcode\UserBBCode</classname>
			<sourcecode>1</sourcecode>
			<attributes>
				<attribute name="0">
					<validationpattern><![CDATA[^\d+$]]></validationpattern>
					<required>1</required>
				</attribute>
			</attributes>
		</bbcode>
		<bbcode name="html">
			<isBlockElement>1</isBlockElement>
			<sourcecode>1</sourcecode>
			<buttonlabel>wcf.editor.button.woltlabHtml</buttonlabel>
			<wysiwygicon>file-code</wysiwygicon>
		</bbcode>
		<bbcode name="wsa">
			<classname>wcf\system\bbcode\WoltLabSuiteArticleBBCode</classname>
			<attributes>
				<attribute name="0">
					<validationpattern><![CDATA[^\d+$]]></validationpattern>
					<required>1</required>
					<usetext>1</usetext>
				</attribute>
			</attributes>
		</bbcode>
		<bbcode name="group">
			<sourcecode>1</sourcecode>
			<classname>wcf\system\bbcode\GroupBBCode</classname>
			<attributes>
				<attribute name="0">
					<validationpattern><![CDATA[^\d+$]]></validationpattern>
					<required>1</required>
				</attribute>
			</attributes>
		</bbcode>
		<bbcode name="mark">
			<htmlopen><![CDATA[mark]]></htmlopen>
			<htmlclose><![CDATA[mark]]></htmlclose>
			<attributes>
				<attribute name="0">
					<html><![CDATA[class="%s"]]></html>
					<validationpattern><![CDATA[^marker-(info|error|success|warning)$]]></validationpattern>
					<required>1</required>
				</attribute>
			</attributes>
		</bbcode>
	</import>
</data>
